Season,Episode,Seasonnum,Episodenum,Airdate,Airyear,Host,HostClean,MusicalGuest,Description,Gender,GenderNum,Profession
S1,Ep1,1,1,10/11/1975,1975,George Carlin,George Carlin,Billy Preston & Janis Ian,"The host for the episode is George Carlin, and the musical guests are Billy Preston and Janis Ian. The skits for this episode are as follows: an ESL teacher gives increasingly bizarre sentences to his student, who repeats his every word; until the teacher suffers a fatal heart attack, and the student dutifully acts out an identical ""death"". New Dad Insurance offers bereaved families a new father to take the place of their deceased one. A distraught rape victim in a courtroom describes the attacker's words in writing, which then confuses an inattentive jurist. Andy ...",M,0,Comedian
S1,Ep2,1,2,10/18/1975,1975,Paul Simon,Paul Simon,Randy Newman & Phoebe Snow,"The host for the episode is Paul Simon, and the musical guests are Randy Newman and Phoebe Snow. The skits for this episode are as follows: former Chicago Seven member Billy Rubin pitches graffiti wallpaper. The Bees are informed by Paul Simon that their skit has been cut from this week's show. Albert Brooks presents a film of failed Candid Camera-style stunts. A mock commercial demonstrates the strength of Try-Hard batteries in a head-to-head contest powering pacemakers. During the Weekend Update, Chevy Chase reports about President's Ford's car accident and Muhammad...",M,0,Musician
S1,Ep3,1,3,10/25/1975,1975,Rob Reiner,Rob Reiner,None,"The host for the episode is Rob Reiner, but there is no musical guest. The skits for this episode are as follows: a man in a wheelchair inadvertently discovers he can walk, but is unable to repeat the miraculous feat. Rob Reiner performs a number of lounge-singer acts. The National Pancreas Association stresses the importance of taking good care of your pancreas. Rob Reiner, together with his wife Penny Marshall, honors some of the more popular fashion faux-pas. The Golden Needles voodoo acupuncture technique offers healing without surgery. Andy Kaufmann sings along ...",M,0,Actor
S1,Ep4,1,4,11/08/1975,1975,Candice Bergen,Candice Bergen,Esther Phillips,"The host for the episode is Candice Bergen, and the musical guest is Esther Phillips. The skits for this episode are as follows: President Ford gives an accident-laden introduction to the show. Candice Bergen is interrupted during her monologue by one of the Bees. A commercial informs viewers of the opportunities for wealth by becoming an ambassador. A man demanding to see his CIA file is faced with a seemingly insurmountable pile of disarray. A special on intelligent animals profiles the dangerous land shark. A gay man has fond memories of dressing in his mother's ...",F,1,Actor
S1,Ep5,1,5,11/15/1975,1975,Robert Klein,Robert Klein,"ABBA, Loudon Wainwright III","The host for the episode is Robert Klein, and the musical guests are ABBA and Loudon Wainwright III. The skits for this episode are as follows: Sherry wins the Miss America beauty pageant, but refuses to accept the honor. Two men discuss the results of their latest mid-term exam while playing Pong. One of the Bees delivers an inspirational message for the Bicentennial about moments in Bee history. An interviewer asks Greg Allman about his love life, but Allman keeps trying to steer the conversation elsewhere. Director Sam Peckinpah describes his vision to a new ...",M,0,Comedian
S1,Ep6,1,6,11/22/1975,1975,Lily Tomlin,Lily Tomlin,None,"The host for the episode is Lily Tomlin, but there is no musical guest. The skits for this episode are as follows: President Ford attempts to speak to the American people while also answering the phones, and manages to hit his head and tumble over his desk. Beethoven, struggling to come up with a new symphony, creates ""Tie a Yellow Ribbon,"" ""My Girl"" and ""What'd I say?"". The Land shark continues to prey on unsuspecting apartment dwellers, but just before the shark hunters can catch it, they are told to cut the skit short. A bellboy at the Atlanta Hotel is shocked to ...",F,1,Actor
S1,Ep7,1,7,12/13/1975,1975,Richard Pryor,Richard Pryor,Gil Scott-Heron,"The host for the episode is Richard Pryor, and the musical guest is Gil Scott-Heron. The skits for this episode are as follows: Garrett Morris tricks Chevy Chase into taking a bad fall during a skit. Richard Pryor does an opening monologue about why he doesn't drink or take LSD. A man checks into a hotel managed by a samurai who speaks no English. A black author talks about his latest book in which he disguises himself as white. A woman tries to identify her attacker from a series of stacked line-ups. An interview for a job using word association turns racially tense....",M,0,Comedian
S1,Ep8,1,8,12/20/1975,1975,Candice Bergen,Candice Bergen,Martha Reeves & The Stylistics,"The host for the episode is Candice Bergen (her second appearance), and the musical guests are Martha Reeves and The Stylistics. The skits for this episode are as follows: President Ford delivers a special message for Christmas and falls out of a tree. An ad for a restaurant where customers can choose their cow, kill it and butcher it. A boy calls home from the police station to tell his parents he's killed 26 people. Candice Bergen invites people to send home movies to NBC, then shows her own movie of herself ice skating with the Bees. A young man comes out of the ...",F,1,Actor
S1,Ep9,1,9,01/10/1976,1976,Elliott Gould,Elliott Gould,Anne Murray,"The host for the episode is Elliott Gould, and the musical guest is Anne Murray. The skits for this episode are as follows: A quartet of dead musicians perform a piece. Elliott Gould sings during his opening monologue. Gilda Radner and Elliott profess their love for each other through the course of the show and get married. A housewife is caught off guard when a couple of workmen come to destroy her home. The Godfather talks about his feelings about the Tattaglia family in a group therapy session. A commercial presents Shimmer, a combination floor wax and dessert ...",M,0,Actor
S1,Ep10,1,10,01/17/1976,1976,Buck Henry,Buck Henry,"Bill Withers, Toni Basil","The host for the episode is Buck Henry, and the musical guests are Bill Withers, Toni Basil and The Blues Brothers. The skits for this episode are as follows: A suicide hot-line operator tries and fails to prevent a caller from killing himself. Buck Henry gives a self-effacing speech during the opening monologue, while notices superimposed on the screen tell the real story. A man orders a sandwich at a restaurant run by a samurai. President Ford learns of a new campaign strategy to make him look more intelligent. A speed-reading course is presented that helps people ...",M,0,Other
S1,Ep11,1,11,01/24/1976,1976,Peter Cook & Dudley Moore,Peter Cook & Dudley Moore,Neil Sedaka,"The hosts for the episode are Peter Cook and Dudley Moore, and the musical guest is Neil Sedaka. The skits for this episode are as follows: A bomb squad is called in to investigate a mysterious package, but unfortunately does not defuse it in time. A casting director for a new Tarzan movie is faced with an aspiring actor auditioning for the lead role, despite having one leg. A maximum-security prison holds auditions for a production of Gigi, in which several of the inmates perform songs they've prepared. Don Pardo presents a luxury vacation plan from inside an ...",M,0,Actor
S1,Ep12,1,12,01/31/1976,1976,Dick Cavett,Dick Cavett,Jimmy Cliff,"The host for the episode is Dick Cavett, and the musical guest is Jimmy Cliff. The skits for this episode are as follows: Garrett Morris uses voodoo to get Chevy to fall down. Commercials attempt to draw students into The Dick Cavett School of Auto Refinishing and The Dick Cavett School of Hydroplane Operation. An accounting firm talks about just how far they'll go to lower their customers' tax bills. Dick Cavett does his version of ""Our Town"" about New York City, a swell place where crime is rampant and nothing works. Betty Ford gives a personal advice talk where she...",M,0,Other
S1,Ep13,1,13,02/14/1976,1976,Peter Boyle,Peter Boyle,Al Jarreau,"The host for the episode is Peter Boyle, and the musical guest is Al Jarreau. The skits for this episode are as follows: A restaurant customer in 1929 Chicago asks the waiter to park his car for him, sending the man into the St. Valentine's Day Massacre. Peter Boyle sings a love song to his girlfriend for the opening monologue, oblivious to the fact that she's making out with another man. The Samurais decide to get divorced and must go about splitting their assets, as well as dividing custody of their daughter. Three little girls lip-sync a Natalie Cole song. A pair ...",M,0,Actor
S1,Ep14,1,14,02/21/1976,1976,Desi Arnaz,Desi Arnaz,"Desi Arnaz, Jr.","The host for the episode is Desi Arnaz, and the musical guest is Desi Arnaz, Jr. The skits for this episode are as follows: President Ford receives a word-association test from his psychiatrist that ends with him falling over. Desi Arnaz gives his opening monologue, in which he thanks the cast for the special cigars they gave him. Prisoner Ruben Carter talks about how he gets recognized in prison now because of his National Express card. A man receives consoling from his friends when his 40th birthday doesn't go as he had hoped. Vampire Luciana Vermicelli shares her ...",M,0,Actor
S1,Ep15,1,15,02/28/1976,1976,Jill Clayburgh,Jill Clayburgh,Leon Redbone & The Singing Idlers,Mr. Bill makes his first appearance.,F,1,Actor
S1,Ep16,1,16,03/13/1976,1976,Anthony Perkins,Anthony Perkins,Betty Carter,"The host for the episode is Anthony Perkins, and the musical guest is Betty Carter. The skits for this episode are as follows: Chevy Chase delivers a long and rambling monologue in which he berates critics who claim the cast deliberately wastes time to fill up a 90-minute time slot. In his opening monologue, Anthony Perkins attempts to dispel the common perception that he is creepy, only to finish by eating a fly. President Ford shares his thoughts on marijuana usage. A new dominatrix cleaning service tries to whip lazy housewives into shape. Norman Bates pitches his ...",M,0,Actor
S1,Ep17,1,17,04/17/1976,1976,Ron Nessen,Ron Nessen,Patti Smith Group,"The host for the episode is press secretary to President Ford Ron Nessen, and the musical guest is Patti Smith. The skits for this episode are as follows: The opening act features a return of the dead string quartet. Ron Nessen's opening monologue includes a message from the actual President Ford. An ad for the Bass o' Matic promises a new way for viewers to enjoy bass. Nessen asks the president for permission to appear on a new comedy show, then briefs his boss on his daily schedule. A string of jam advertisers pitch products with increasingly disgusting names, since...",M,0,Other
S1,Ep18,1,18,04/24/1976,1976,Raquel Welch,Raquel Welch,"Phoebe Snow, John Sebastian",Lorne Michaels tries to lure the Beatles onto the show. Baba Wawa makes her first appearance.,F,1,Actor
S1,Ep19,1,19,05/08/1976,1976,Madeline Kahn,Madeline Kahn,Carly Simon,"The host for this episode is Madeline Kahn, and the musical guest is Carly Simon. The skits for this episode are as follows: Ronald Reagan attempts to demonstrate that he's in tune with modern black culture, only to get punched out by the musician he keeps inadvertently insulting. A preview for the upcoming series, Wilderness Comedian, presents a man who does stand-up comedy for animals. Baba Wawa attempts to interview Marlene Dietrich, but neither can understand what the other is saying. At a slumber party, several girls are disgusted by the thought of how babies are...",F,1,Actor
S1,Ep20,1,20,05/15/1976,1976,Dyan Cannon,Dyan Cannon,Leon & Mary Russell,"The host for the episode is Dyan Cannon, and the musical guests are Leon & Mary Russell. The skits for this episode are as follows: Chevy Chase, lying on his back after a tremendous fall, is informed that the control room clock was running fast and he'll have to do it all again to get it on air. During her opening monologue, Dyan Cannon confesses to a lifelong dream of being swept off her feet by a man on a white horse, and during the rest of the show, different male cast members attempt to re-interpret its meaning to make themselves her dream man. A woman takes a ...",F,1,Actor
S1,Ep21,1,21,05/22/1976,1976,Buck Henry,Buck Henry,Gordon Lightfoot,"The host for the episode is Buck Henry (his second appearance), and the musical guest is Gordon Lightfoot. The skits for this episode are as follows: Chevy Chase announces that because he broke his ankle accepting his Emmy Award, his fall will be done by Laraine Newman, but Laraine instead shoves him off the stage. Buck Henry is supposed to come on for his opening monologue, but is nowhere to be found; after a frantic search, the crew discovers that the security guards don't recognize him and won't let him in the building. Lounge singer Peter Lemon advertises a mood ...",M,0,Other
S1,Ep22,1,22,05/29/1976,1976,Elliott Gould,Elliott Gould,"Leon Redbone, Harlan Collins & Joyce Everson","The host for the episode is Elliott Gould (his second appearance), and the musical guests are Leon Redbone (his second appearance), Harlan Collins and Joyce Everson. The skits for this episode include scenes inside a wax museum and a European poker player, as well as a presentation by Shirley Temple Black. Re-run ads inform viewers how they can join the fast-paced life of stand-by operators, and asks America to show their guns. A doctor warns a woman that she's been neglecting the proper care of her uvula. The crew of The Enterprise faces their final foe: network ...",M,0,Actor
S1,Ep23,1,23,07/24/1976,1976,Louise Lasser,Louise Lasser,Preservation Hall Jazz Band,"The host for the episode is Louise Lasser, and the musical guest is The Preservation Hall Jazz Band. The skits for this episode are as follows: John Belushi and Chevy Chase have an argument over how the opening to the show should be done. After Louise Lasser's opening monologue, General Idi Amin comes on to warn viewers about the importance of checking oneself for V.D., using himself as an example of the effects of advanced-stage syphilis. In a parody of Swedish films, a couple involved in a secret affair fool death by sending him out for a pizza. An advertisement ...",F,1,Actor
S1,Ep24,1,24,07/31/1976,1976,Kris Kristofferson,Kris Kristofferson,Rita Coolidge,"The host for the episode is Kris Kristofferson, and the musical guest is Rita Coolidge. The skits for this episode are as follows: Kris Kristofferson sings ""Help Me Make It Through The Night"" after Chevy Chase falls out of bed, where he was with musical guest Rita Coolidge. After Kris' monologue, secretary Sherry Norwalk talks about how she got a job at SNL helping the writers come up with ideas by having sex with them. The Samurai general practitioner treats one of his patients. Jesse Owens presents a set of commemorative medals honoring white athletes. A clip from a...",M,0,Actor
S2,Ep1,2,1,09/18/1976,1976,Lily Tomlin,Lily Tomlin,James Taylor,"The host for the episode is Lily Tomlin (her second appearance), and the musical guest is James Taylor. The skits for this episode are as follows: For the opening skit, everyone is waiting around for Lily Tomlin to arrive, but she shows up late and announces she's not going to bother rehearsing for the show. After Lily's opening monologue, she begins talking about what she really thinks of the show, thinking that her microphone is off. President Ford gets into a strange debate with Jimmy Carter. During the Weekend Update, Laraine Newman reports on an outbreak of ...",F,1,Actor
S2,Ep2,2,2,09/25/1976,1976,Norman Lear,Norman Lear,Boz Scaggs,"The host for the episode is Norman Lear, and the musical guest is Boz Scaggs. The skits for this episode are as follows: Chevy Chase, in the hospital after injuring himself in the previous episode, coaches Gilda Radner through the opening via telephone. Norman Lear gets to hear what the actors in his shows really think of him. Jimmy Carter discusses lust in his heart and looks forward to more lusting as president. Norman Lear reviews the pilot of a new show about a family of snake handlers in Pittsburgh. During the Weekend Update, Jane Curtain discusses the ...",M,0,Other
S2,Ep3,2,3,10/02/1976,1976,Eric Idle,Eric Idle,Joe Cocker & Stuff,"The host for the episode is Eric Idle, and the musical guests are Joe Cocker and Stuff. The skits for this episode are as follows: A Chevy Chase impersonator attempts to do the opening fall. Eric Idle starts to perform a song, but is convinced by Jane Curtain to put it off until the end of the show. A young couple discusses assembling their new child with the help of a geneticist who presents them with bizarre options. A DJ attempts to work two stations simultaneously, maintaining opposite personas for each one. Baba Wawa talks to America about why she's leaving NBC. ...",M,0,Actor
S2,Ep4,2,4,10/16/1976,1976,Karen Black,Karen Black,John Prine,"The host for the episode is Karen Black, and the musical guest is John Prine. The skits for this episode are as follows: Chevy Chase returns after his injury and is pushed out of his wheelchair by John Belushi. Karen Black talks about her son and great mothers in history during her opening monologue. Baba Wawa interviews Indira Gandhi. Ford and Carter have another unusual debate. A re-run ad pitches amazing new triple-bladed razors. Amish crime fighters help out victims when catching crooks quickly isn't a priority. A wife feeds her husband Green Cross cupcakes since ...",F,1,Actor
S2,Ep5,2,5,10/23/1976,1976,Steve Martin,Steve Martin,Kinky Friedman,"The host for the episode is Steve Martin, and the musical guest is Kinky Friedman. The skits for this episode are as follows: The coach of the Yankees consoles his team after losing the World Series, and one of the players gives him their final decision. Chevy Chase attempts to make an endorsement for milk, but keeps adding in its less pleasant effects. An episode of Jeopardy from 1999 gives a look at some social changes in the future. During the Weekend Update, Chevy comments on Jimmy Carter's cross-dressing, the latest election poll results, a mafia funeral in a ...",M,0,Comedian
S2,Ep6,2,6,10/30/1976,1976,Buck Henry,Buck Henry,The Band,"The host for the episode is Buck Henry (his third appearance), and the musical guest is The Band. The skits for this episode are as follows: The land shark makes its return, pretending to be a late trick-or-treater. In his opening monologue, Buck Henry praises the cast for being able to perform so professionally in light of how absolutely messed up their personal lives are. The samurai stockbroker loses one of his clients after a string of bad advice. Baba Wawa has a joint interview with First Ladies Betty Ford and Rosalynn Carter. Garrett Morris discuss his own roots...",M,0,Other
S2,Ep7,2,7,11/13/1976,1976,Dick Cavett,Dick Cavett,Ry Cooder,"The host for the episode is Dick Cavett (his second appearance), and the musical guest is Ry Cooder. The skits for this episode are as follows: The Chroma-Trak girl gets her colors mixed up during broadcast. Dick Cavett fields questions from the audience during his opening monologue. John Dean looks back on Nixon trying to frame him for Watergate. During the Weekend Update, Laraine Newman reports on the death and cremation of Smokey the Bear. A marine walks down the street, looking to pick up a few good men. A psychiatrist makes house calls. The Bees talk about how ...",M,0,Other
S2,Ep8,2,8,11/20/1976,1976,Paul Simon,Paul Simon,George Harrison,"The host for the episode is Paul Simon (his second appearance), and the musical guest is George Harrison. The skits for this episode are as follows: George Harrison feels that he should receive the $3000 Lorne Michaels promised the Beatles for appearing on the show, while Paul Simon has doubts about the costume he's been asked to wear. Paul Simon starts to sing ""Still Crazy After All These Years"" dressed as a turkey, but gives up halfway through and tells Lorne he won't do it. A housewife raves about mineral-packed Quarry cereal. Baba Wawa interviews Henry Kissenger. ...",M,0,Musician
S2,Ep9,2,9,11/27/1976,1976,Jodie Foster,Jodie Foster,Brian Wilson,"The host for the episode is Jodie Foster, and the musical guest is Brian Wilson. The skits for this episode are as follows: Gilda Radner opens the show to explain why she won't be appearing much, while caption explain that she's been fired. Jodie Foster explains in her opening monologue that she's treated just like every other guest even though she's just 14. Chevy Chase advertises convenient feedbag dinners. Two Bees come into a girl's room claiming they're Peter Pan and Tinkerbee. Jodie demonstrates the new Puberty Helper to get teens through their awkward years. A ...",F,1,Actor
S2,Ep10,2,10,12/11/1976,1976,Candice Bergen,Candice Bergen,Frank Zappa,"The host for the episode is Candice Bergen (her third appearance), and the musical guest is Frank Zappa. The skits for this episode are as follows: For the opening, Patty Hearst enjoys a Christmas back with her family. Instead of doing her opening monologue, Candice Bergen hides in her dressing room and has to be coaxed out by John Belushi doing a Humphrey Bogart impression. President-elect Carter admits he can't follow through on all the things he promised during the campaign. A pitchman convinces a woman to use Santi-Wrap before sitting on the lap of a disreputable ...",F,1,Actor
S2,Ep11,2,11,01/15/1977,1977,Ralph Nader,Ralph Nader,George Benson,"The host for the episode is Ralph Nader, and the musical guest is George Benson. The skits for this episode are as follows: Ralph Nader announces that he's going to relax and have fun for this week's show, but soon begins lecturing everyone on safety hazards throughout the studio. During Ralph's opening monologue, he rails against NBC's parent corporation, RCA, only to be cut off by a technical glitch. A grandfather waiting for his grandson to call starts ranting about the boy's thoughtlessness. A convict goes through a dress rehearsal for a televised execution. Baba ...",M,0,Other
S2,Ep12,2,12,01/22/1977,1977,Ruth Gordon,Ruth Gordon,Chuck Berry,"The host for the episode is Ruth Gordon, and the musical guest is Chuck Berry. The skits for this episode are as follows: John Belushi's doctor announces that he will cut off the cast's drug supply if they don't put John in tonight's show. Barbra Streisand performs a song that's all about herself. Emily Litella visits with her sister to talk about current events. Dino De Laurentiis gives an interview with Tom Snyder about his new remake of King Kong, claiming that his ape was much easier to work with than the original Kong. During the Weekend Update, Laraine Newman ...",F,1,Actor
S2,Ep13,2,13,01/29/1977,1977,Fran Tarkenton,Fran Tarkenton,"Leo Sayer, Donnie Harper and the Voices of Tomorrow","The host for the episode is Fran Tarkenton, and the musical guests are Leo Sayer and The Donny Harper Singers. The skits for this episode are as follows: John Belushi gives Fran Tarkenton a pre-game pep talk. Bill Murray provides color commentary as Fran sings ""Feelings"" for his opening monologue. A salesman pitches multi-purpose Swiss Army guns. Amy Carter goes to class and uses the Secret Service to cheat on a quiz. A football coach sends his player back in the game, despite his missing a limb. Garrett Morris interviews Fran on the subject of black quarterbacks. A ...",M,0,Sports
S2,Ep14,2,14,02/20/1977,1977,None,None,Randy Newman,"There's no host for this broadcast. Randy Newman is the musical guest for this episode, which is performed live in New Orleans for the Mardi Gras celebration. The skits for this episode are as follows: President Carter attempts to inspire Americans with a speech delivered from the rear end of a statue of Andrew Jackson on his horse, while Rosalyn frets over the fact that Jimmy has been up there for two days. For his opening monologue, Randy Newman sings about the floods that damaged New Orleans, then announces that SNL teams are in place to cover the passing of the ...",N,9,None
S2,Ep15,2,15,02/26/1977,1977,Steve Martin,Steve Martin,The Kinks,"The host for the episode is Steve Martin (his second appearance), and the musical guest is The Kinks. The skits for this episode are as follows: Steve gets hostility from the cast over his treatment of Gilda since the last show. For his opening monologue, Steve gets happy feet, talks about his goals, then mentions what drugs he and the cast are going to take after the show. The Coneheads receive a visit from the IRS. Jackie Onassis enters a celebrity weightlifting contest. A diet book promises weight loss by using the pages of the book itself as meals. A doctor ...",M,0,Comedian
S2,Ep16,2,16,03/12/1977,1977,Sissy Spacek,Sissy Spacek,Richard Baskin,"The host for the episode is Sissy Spacek, and the musical guest is Richard Baskin. The skits for this episode are as follows: Following the death of director Dave Wilson, the show's future is in jeopardy. Sissy Spacek performs a baton twirling scene that was cut from Carrie. A burger restaurant prepares burgers according to the customers' bizarre specifications. President Carter answers call-in questions with very specific answers. A doctor is interviewed about a condition called quintlexia, which he suffers from. John Belushi announces that he's retiring from show ...",F,1,Actor
